Datetime,Tweet Id,Text,Username
2021-09-28 17:27:02+00:00,1442903693267849217,"There will be a #COVID19AB update today at 3:30 pm.
Join us virtually:
➡️Online: https://t.co/lmibh3zeBt
➡️Twitter: https://t.co/Yru945Y5QX
A thread summarizing my remarks will follow here. A video &amp; transcript for today can be found at: https://t.co/fNqBdKnjaS",CMOH_Alberta
2021-09-27 22:17:54+00:00,1442614501983936517,"Vaccines are safe, effective &amp; save lives. If you are unsure about getting vaccinated, seek out credible sources to help understand that the health risks from COVID-19 far outweigh any risks from immunization. To book an appt visit https://t.co/NwxWObBwt1. (4/4)",CMOH_Alberta
2021-09-27 22:17:54+00:00,1442614500478177281,"Sadly, 23 new deaths related to COVID-19 were also reported to Alberta Health in the last 72 hours. I extend my sympathies to all who are grieving the loss of a loved one today. (3/4) https://t.co/38o2pmx5Uu",CMOH_Alberta
2021-09-27 22:17:53+00:00,1442614497613541376,"Over the past 24 hours, we ID’d 1,758 new cases &amp; completed about 15K tests. On Sept 25, we ID’d 1,541 new cases from about 14.8K tests. On Sept 24, 1,882 new cases were ID’d from about 15.9K tests. Complete, up-to-date data can be found here. https://t.co/ZXjL7BGYwA (2/4)",CMOH_Alberta
2021-09-27 22:17:52+00:00,1442614495776415747,"Here is a summary of the latest #COVID19AB numbers: There are now 1,063 people in hospital due to COVID-19. Of the 798 non-ICU, 75.5% are unvaccinated or partially vaccinated. Of the 265 in ICU, 91.7% are unvaccinated or partially vaccinated. (1/4) https://t.co/svbtK1H6fE",CMOH_Alberta
2021-09-24 23:58:44+00:00,1441552715872571394,"All establishments may allow individuals to enter for delivery, pick-up or take-out without requiring proof of vaccination or a neg test result. 

We appreciate all businesses and Albertans for their ongoing efforts to curb COVID-19 transmission provincewide. (4/4)",CMOH_Alberta
2021-09-24 23:58:44+00:00,1441552714572337153,"If an establishment is not participating in the Restrictions Exemption Program, they may only offer outdoor dining with a maximum of 6 people per table from 1 household or 2 close contacts for those living alone. (3/4)",CMOH_Alberta
2021-09-24 23:58:44+00:00,1441552713192407042,"For example, we have received many questions on dining. Restaurants and bars must apply the program consistently, both inside and outside, including patios/bars and can’t only operate some days or times and not others. (2/4)",CMOH_Alberta
2021-09-24 23:58:43+00:00,1441552711674056709,"It's important for Albertans to fully understand public health measures in order for them to be as effective as possible, so we have provided an updated order and guidance online to clarify the Restrictions Exemption Program. https://t.co/yWkcrIuJ6y (1/4)",CMOH_Alberta
2021-09-24 23:12:28+00:00,1441541071922614276,"This weekend, help curb transmission by respecting gathering limits &amp; staying home if feeling unwell. Indoor social gatherings are not permitted for unvaccinated ABs ages 12+ &amp; limited to a max of 10 ppl from 2 households for ppl who are vaccinated.  https://t.co/yWkcrIuJ6y (4/4)",CMOH_Alberta
2021-09-24 23:12:28+00:00,1441541070446157826,"Sadly, 11 new deaths related to COVID-19 were also reported to Alberta Health in the last 24 hours. I extend my sincere condolences to all who are grieving today. (3/4) https://t.co/93VJVWXLAX",CMOH_Alberta
2021-09-24 23:12:27+00:00,1441541067547942919,"Over the past 24 hours, we identified 1,651 new cases &amp; completed about 16.8K tests. Complete, up-to-date data, including breakdowns by region, can be found here. https://t.co/ZXjL7BGYwA (2/4)",CMOH_Alberta
2021-09-24 23:12:27+00:00,1441541065681424384,"Here is a summary of the latest #COVID19AB numbers: There are now 1,061 people in hospital due to COVID-19. Of the 818 non-ICU, 75.5% are unvaccinated or partially vaccinated. Of the 243 in ICU, 91.7% are unvaccinated or partially vaccinated. (1/4) https://t.co/0BLFYNnTDi",CMOH_Alberta
2021-09-24 21:01:13+00:00,1441508039903772673,"As this is the first week of the new Restrictions Exemption program, I encourage everyone to plan accordingly, and be patient as businesses and service providers iron out their procedures for checking everyone’s proof. (4/4)",CMOH_Alberta
2021-09-24 21:01:13+00:00,1441508038712573957,"I want to thank the majority of ABs who continue to do the right thing, getting vaccinated &amp;downloading their proof of vaccination at https://t.co/rAx63hrICu (3/4)",CMOH_Alberta
2021-09-24 21:01:12+00:00,1441508037529718787,"To be clear: falsifying records is against the best interest of Albertans' health and is a criminal offence under the Criminal Code &amp; may also be an offense under the Health Information Act. Rather than risk potential consequences, get vaccinated. It's your best protection. (2/4)",CMOH_Alberta
2021-09-24 21:01:12+00:00,1441508035726233605,We are hearing reports of ppl trying to falsify proof of #COVID19AB vaccination records. We are at a critical time &amp; need ABs to do all they can to help reduce strain on the health system. We need ppl to abide by current restrictions &amp; not look for ways around the rules. (1/4),CMOH_Alberta
2021-09-23 22:37:13+00:00,1441169812860796928,"With high transmission right now, anyone could be re-infected &amp; transmit COVID-19 to others who may be more vulnerable to severe outcomes. That is why masking in indoor public spaces &amp; staying at home when feeling ill is mandatory for everyone in all areas of Alberta. (10/10)",CMOH_Alberta
2021-09-23 22:37:13+00:00,1441169811376013320,"Those who have had COVID-19 &amp; recovered are not exempt from the Restrictions Exemption Program. Everyone needs proof of vaccine, or a recent negative result on a privately purchased test, to enter businesses in the program. It is still best to get fully vaccinated. (9/10)",CMOH_Alberta
2021-09-23 22:37:13+00:00,1441169810033762309,No vaccine is 100% effective. A very small % of fully vaccinated ppl will still get COVID-19 if exposed or have conditions that mean their body cannot respond fully to vaccines. Preventing breakthrough cases requires the rest of us to form a protective shield around them. (8/10),CMOH_Alberta
2021-09-23 22:37:12+00:00,1441169808456749058,"Rumours that vaccines don’t work against the Delta variant are categorically untrue. In AB, COVID-19 vaccines have proven to be 85% effective against infection w/ Delta after 2 doses. COVID-19 vaccines are even more highly effective at preventing severe disease &amp; death. (7/10)",CMOH_Alberta
2021-09-23 22:37:12+00:00,1441169806690897927,ABs who have not been fully vaccinated are about 15x more likely than those w/ 2 doses to end up in the hosp from COVID-19. They are about 40x more likely to be admitted to the ICU. About 77% of ABs in hospital w/ COVID-19 &amp; 92% in ICU are not fully vaccinated. (6/10) https://t.co/UjPG0PfEmE,CMOH_Alberta
2021-09-23 22:37:11+00:00,1441169802991575043,"Every Albertan turning 12 this year and older has been eligible to get vaccinated for about 4 months. I cannot stress enough the importance of making this choice — to protect you, those around you, our communities, and our health-care system. (5/10)",CMOH_Alberta
2021-09-23 22:37:10+00:00,1441169801397694465,"To date we have not seen an increase in the proportion of young people that are experiencing severe outcomes from COVID. By lowering transmission in all ages &amp; by eligible ABs getting vaccinated, we can help protect those who aren’t old enough yet to access vaccine. (4/10)",CMOH_Alberta
2021-09-23 22:37:10+00:00,1441169799325704198,"In the last 24hrs, we ID’d 1,660 new cases &amp; completed about 18K tests. Our + rate is about 9.4%. 1,058 ppl are in hospital, incl 226 in ICU. 100% of new ICU admissions were unvaccinated. Sadly, 17 new deaths were also reported. My condolences go to anyone mourning a loss. (3/10) https://t.co/Ivep5wKP4U",CMOH_Alberta
2021-09-23 22:37:09+00:00,1441169795106295813,"Living in the same home as someone w/ COVID puts you at the highest risk of infection &amp; spreading the virus to others. This is not for other close contacts, such as classmates in school or a workplace. There are other health measures already in place for these settings. (2/10)",CMOH_Alberta
2021-09-23 22:37:08+00:00,1441169793109741582,Here is a summary of today’s #COVID19AB update: We have added to the daily symptom screening checklist the recommendation that unvaccinated &amp; partially vaccinated individuals quarantine for 14 days if they have been exposed to a + COVID case in their household. (1/10),CMOH_Alberta
2021-09-23 17:21:22+00:00,1441090326068805647,"There will be a #COVID19AB update today at 3:30 pm.
Join us virtually:
➡️Online: https://t.co/lmibh3zeBt
➡️Twitter: https://t.co/Yru945Y5QX
A thread summarizing my remarks will follow here. A video &amp; transcript for today can be found at: https://t.co/fNqBdKnjaS",CMOH_Alberta
2021-09-23 15:40:15+00:00,1441064880014905349,"No matter what your reasons are for waiting up to now, it is not too late to get your vaccine. It will help protect you and others around you from severe illness or even death from COVID-19. https://t.co/BBHL5sBDLY",CMOH_Alberta
2021-09-22 22:40:05+00:00,1440808143680770048,"Our actions, such as going out while symptomatic, have very real consequences to those around us. Staying home when we feel unwell, wearing our masks when out in public, &amp; getting vaccinated are critical to limiting the potential spread of COVID-19. https://t.co/NwxWObBwt1. (4/4)",CMOH_Alberta
2021-09-22 22:40:04+00:00,1440808142078550021,"Sadly, 20 new COVID-19 related deaths were reported to AB Health in the last 24hrs, ranging in age from &lt;20 to &gt;90. This is a sad reminder, that regardless of age, unvaccinated ABs are at higher risk of severe outcomes. I extend my condolences to everyone grieving today. (3/4) https://t.co/gLIqtwEtms",CMOH_Alberta
2021-09-22 22:40:03+00:00,1440808139285164033,"Over the past 24 hours, we identified 1,336 new cases &amp; completed about 14.5K tests. Complete, up-to-date data, including breakdowns by region, can be found here. https://t.co/ZXjL7BGYwA (2/4)",CMOH_Alberta
2021-09-22 22:40:03+00:00,1440808137208983553,"Here is a summary of the latest #COVID19AB numbers: There are now 1,040 people in hospital due to COVID-19. Of the 810 non-ICU, 74.8% are unvaccinated or partially vaccinated. Of the 230 in ICU, 91.8% are unvaccinated or partially vaccinated. (1/4) https://t.co/Gi1ro6YdIQ",CMOH_Alberta
2021-09-22 01:23:22+00:00,1440486851161194503,"We all must do our part now by getting vaccinated if you haven’t already &amp; reducing the spread of COVID-19 by limiting contact w/ppl outside your household as much as possible. These measures work, but it takes all of us making safe choices every day, in everything we do. (10/10)",CMOH_Alberta
2021-09-22 01:23:21+00:00,1440486847247904769,"Our goal is to vaccinate as many Albertans as possible, as safely as possible. We will move quickly to offer vaccine to additional age groups if it is approved by Health Canada &amp; recommended by NACI. Until then, we all need to protect younger children. (9/10)",CMOH_Alberta
2021-09-22 01:23:21+00:00,1440486843569426433,I know many parents are wondering when vaccines will be avail for kids under 12. Global studies are underway looking into whether we can offer COVID vaccines to ages 5-12. We will not offer vaccine to this age group until these studies are completed &amp; evaluated. (8/10),CMOH_Alberta
2021-09-22 01:23:20+00:00,1440486841354842112,"Some ppl remain vulnerable &amp; to help protect them, all of us can do our part by getting our two doses. Individuals who have these health conditions and seniors in congregate care are the only groups to whom we are offering third doses or booster shots for clinical reasons. (7/10)",CMOH_Alberta
2021-09-22 01:23:19+00:00,1440486837525512198,"We are aligning our approach to 3rd dose eligibility w/recent NACI recommendations to incl ppl undergoing CAR-T therapy, using high-dose steroids &amp; other immunosuppressant drugs, w/Stage 3 or adv HIV infection &amp; those w/genetic immunodeficiency syndromes. (6/10)",CMOH_Alberta
2021-09-22 01:23:19+00:00,1440486834702729217,"Sadly, 29 deaths were reported in the last 24hrs. Some of these ppl were 2X vaccinated &amp; had compromised immune systems. Most were unvaccinated. Our actions every day are literally a matter of life and death. My deepest sympathies go out to everyone who is grieving a loss. (5/10) https://t.co/o6vXnl0yl9",CMOH_Alberta
2021-09-22 01:23:17+00:00,1440486828486770700,"Over the last 24hrs, we have identified 1,519 new cases of COVID-19 and completed about 13.6K tests. Our positivity rate is at 11.1%. We have ID’d 2,011 additional VoC cases in the last 24hrs. There are 996 people in hospital being treated for COVID-19, incl 222 in ICU. (4/10) https://t.co/uyOpZFHRcF",CMOH_Alberta
2021-09-22 01:23:15+00:00,1440486821448667139,"Masking is mandatory in all indoor public spaces across AB, even in businesses that have implemented the Restrictions Exemption Program. Get vaccinated &amp; continue to follow the health measures so we can drive cases down &amp; stop the current spike in hospitalizations. (3/10)",CMOH_Alberta
2021-09-22 01:23:15+00:00,1440486818198155265,"Some facilities are requiring proof of vaccine for ABs &lt;18. Operators can set rules that exceed min CMOH order requirements &amp; I clearly support vaccine protection, but encourage facility operators to let youth &lt;18 use your facilities w/other COVID precautions in place. (2/10)",CMOH_Alberta
2021-09-22 01:23:14+00:00,1440486816205848588,"Here is a summary of today’s #COVID19AB update: First a clarification: Physical activity is critical for the overall health &amp; well-being of youth, &amp; necessary to daily living, so youth sports &amp; recreation activities are not part of the Restrictions Exemption Program. (1/10)",CMOH_Alberta
2021-09-21 17:49:57+00:00,1440372745074659338,"There will be a #COVID19AB update today at 5 pm.
Join us virtually:
➡️Online: https://t.co/lmibh3zeBt
➡️Twitter: https://t.co/Yru945Y5QX
A thread summarizing my remarks will follow here. A video &amp; transcript for today can be found at: https://t.co/fNqBdKnjaS",CMOH_Alberta
2021-09-20 23:42:30+00:00,1440099075966177285,"I also want to remind parents who may be hesitant to have their children vaccinated, that vaccines are safe &amp; I strongly support the immunization of all eligible Albertans, including those age 12 &amp; up. (4/4)",CMOH_Alberta
2021-09-20 23:42:29+00:00,1440099074611376129,"While nothing prohibits these organizations from doing so. I encourage organizations to allow all youth U-18 to participate in sport, recreation and performance activities &amp; focus on other ways to reduce COVID-19 risk in these settings. (3/4)",CMOH_Alberta
2021-09-20 23:42:29+00:00,1440099073218912260,"Some arenas &amp; facilities serving both adult &amp; youth populations, have decided to take a 1-size-fits-all approach to requiring proof of vaccination, eliminating options for unvaccinated youth U-18 to take part in sport, recreation/performance activities. (2/4)",CMOH_Alberta
2021-09-20 23:42:29+00:00,1440099071763496960,"Physical activity is critically important for the overall health &amp; well-being of youth &amp; is necessary to daily living. That is why AB government decided against requiring proof of vaccination for youth U-18 who are taking part in sport, rec &amp; performance activities. (1/4)",CMOH_Alberta
2021-09-20 22:49:26+00:00,1440085724854947840,Alberta’s Restriction Exemption program also starts today. Vaccine-eligible Albertans must provide proof of immunization or a negative privately paid COVID-19 test from w/in 72 hrs to access participating events and businesses throughout the province. (6/6),CMOH_Alberta
2021-09-20 22:49:26+00:00,1440085721881067525,"Temporary measures to help curb transmission are now in effect province-wide incl dining restrictions, capacity limits on retail, entertainment and rec facilities, and physical activity requirements. For a list of all temporary measures visit: https://t.co/yWkcrIuJ6y (5/6)",CMOH_Alberta
2021-09-20 22:49:25+00:00,1440085719507103753,"Sadly, 22 new deaths related to COVID-19 were also reported to Alberta Health over the past 3 days. My sympathy goes to all who are mourning a loss today. (4/6)",CMOH_Alberta
2021-09-20 22:49:25+00:00,1440085716977917954,"Complete, up-to-date data, including breakdowns by region, can be found here. https://t.co/ZXjL7BGYwA (3/6) https://t.co/E5fbelVIbm",CMOH_Alberta
2021-09-20 22:49:24+00:00,1440085712972439553,"Over the past 24 hours, we ID’d 1,436 new cases &amp; completed about 13.4K tests. On Sept 18, we ID’d 1,592 new cases from about 16.5K tests. On Sept 17, 1,605 new cases were ID’d from about 16.4K tests. (2/6)",CMOH_Alberta
2021-09-20 22:49:23+00:00,1440085709352841216,"Here is a summary of the latest #COVID19AB numbers: Today, there are 954 people in hospital due to COVID-19. Of the 738 non-ICU, 79.1% are unvaccinated or partially vaccinated. Of the 216 in ICU, 91.2% are unvaccinated or partially vaccinated. (1/6) https://t.co/Hvtv4avnhS",CMOH_Alberta
2021-09-17 22:28:35+00:00,1438993312216600577,"The new public health measures will not impact the voting process. Please vote. Elections Canada has measures in place to support physical distancing, masking and other ways to reduce transmission. Proof of vaccination is not required to enter a polling place and cast a ballot.",CMOH_Alberta
2021-09-17 22:19:02+00:00,1438990907819237376,We need to do all we can to safeguard ourselves &amp; our health system against the far-reaching impacts of COVID-19 by eliminating opportunities for spread. Vaccines are safe &amp; 2 doses sig. reduce your chance of severe illness. Get your shot today. https://t.co/NwxWObBwt1 (4/4),CMOH_Alberta
2021-09-17 22:19:01+00:00,1438990906581929986,"Sadly, 18 new deaths related to COVID-19 were also reported to Alberta Health in the last 24 hours. I extend my sincere condolences to all who are grieving today. (3/4)",CMOH_Alberta
2021-09-17 22:19:01+00:00,1438990905109671937,"Over the past 24 hours, we identified 2,020 new cases &amp; completed about 17.3K tests. Complete, up-to-date data, including breakdowns by region, can be found here. https://t.co/ZXjL7BGYwA (2/4) https://t.co/f3S290ACBv",CMOH_Alberta
2021-09-17 22:19:00+00:00,1438990901674590208,"Here is a summary of the latest #COVID19AB numbers: There are now 911 people in hospital due to COVID-19. Of the 696 non-ICU, 73.2% are unvaccinated or partially vaccinated. Of the 215 in ICU, 93% are unvaccinated or partially vaccinated. (1/4) https://t.co/4FxuO5hc48",CMOH_Alberta
2021-09-16 22:25:08+00:00,1438630054196436993,"I know many ABs are frustrated &amp; tired. We all play a role in limiting COVID-19 spread &amp; protecting ourselves. By following these rules &amp; the spirit behind them, &amp; avoiding contact as much as possible w/ ppl we don’t live with, we can get back on track and save lives. (11/11)",CMOH_Alberta
2021-09-16 22:25:07+00:00,1438630053001129987,"Finally, businesses do not need to apply for the Restriction Exemption Program. However, audits &amp; enforcement will occur to make sure the rules are being followed. All of the public health orders are mandatory &amp; legally enforceable. (10/11)",CMOH_Alberta
2021-09-16 22:25:07+00:00,1438630051851890693,"Some businesses, incl grocery &amp; gas stations count as “essential for daily living” &amp; won’t have an exemption program. A list of sectors will be posted online. Salons &amp; personal services are subject to masking &amp; distancing except when service is being provided. (9/11)",CMOH_Alberta
2021-09-16 22:25:07+00:00,1438630050677465089,"If seeking a negative COVID test to access a business or service you must get this test privately. AHS’s testing is for those w/symptoms &amp; need it most. Or you can get vaccinated for free to get protection, help beat down the wave, and save you money spent on testing. (8/11)",CMOH_Alberta
2021-09-16 22:25:06+00:00,1438630049498861574,"Another question is whether weddings are limited to 50 ppl w/mandatory vaccination. If the venue implements the proof of immunization program, a wedding/funeral may proceed w/o the cap if all 12+ attendees have valid proof of immunization or a recent neg COVID test. (7/11)",CMOH_Alberta
2021-09-16 22:25:06+00:00,1438630048358039557,"While 2 vaccine doses are about 85% effective against the Delta variant, that leaves a 15% window for infection. With our high COVID-19 rate right now, we need to do all we can to safeguard ourselves &amp; our health-care system, and stop opportunities for COVID-19 to spread. (6/11)",CMOH_Alberta
2021-09-16 22:25:06+00:00,1438630047166844928,"Our health system is straining to treat all COVID-19 cases. While close to 78% of hosp/ICU cases are unvaccinated or only partially vaccinated, 22% are fully vaccinated. Many of them have underlying health conditions affecting their ability to fight off infections. (5/11)",CMOH_Alberta
2021-09-16 22:25:06+00:00,1438630045937901570,"I want to help clarify some details about the restrictions announced yesterday, such as why social gatherings need to be limited if all attendees are vaccinated. I know it was a lot of information at once, and want everyone to fully understand the new rules going forward. (4/11)",CMOH_Alberta
2021-09-16 22:25:05+00:00,1438630044646064129,"Sadly, 10 new deaths were reported to Alberta Health in the last 24 hrs. Every life lost leaves behind grieving family &amp; friends. My sympathies go to those who are mourning today. These &amp; previous deaths, are reminders that there are many vulnerable ppl in our province. (3/11)",CMOH_Alberta
2021-09-16 22:25:05+00:00,1438630043115130880,"Over the last 24 hours, we ID’d 1,718 new cases &amp; completed about 16.3K tests. Our positivity rate was about 10.6%. Hospitalizations continue to rise with 896 people being treated for COVID-19 in hospital, incl 222 in the ICU. There are now 18,706 active cases in Alberta. (2/11) https://t.co/BgRHvNlYQZ",CMOH_Alberta
2021-09-16 22:25:04+00:00,1438630039600320522,"Here is a summary of today’s #COVID19AB update: Given the state of public health emergency issued yesterday, I will be providing regular COVID-19 updates 2X/week to keep Albertans informed &amp; answer questions to the best of my ability. (1/11) https://t.co/XJ2kUsNaUG",CMOH_Alberta
2021-09-16 17:30:34+00:00,1438555927112654880,"There will be a #COVID19AB update today at 3:30 pm.
Join us virtually:
➡️Online: https://t.co/lmibh3zeBt
➡️Twitter: https://t.co/Yru945Y5QX
A thread summarizing my remarks will follow here. A video &amp; transcript for today can be found at: https://t.co/fNqBdKnjaS",CMOH_Alberta
2021-09-16 15:30:17+00:00,1438525655491043335,"These coming days and weeks are critical to reducing transmission in our communities. Let’s all be safe, take care and be kind to each other. We will get through this. https://t.co/GGgIF9t9Jj",CMOH_Alberta
2021-09-16 00:50:53+00:00,1438304349516701696,I must stress how important it is for all of us to follow all these measures &amp; reduce in-person contacts as much as possible. We've seen these steps work during previous waves of this pandemic. They will work if we all embrace them to bend the curve again. (7/7),CMOH_Alberta
2021-09-16 00:50:53+00:00,1438304348086448131,We are seeing rapid spread across AB and each of these new measures acts as a layer to help stop transmission. They are meant to work together to reduce the risk of transmission and bend down the curve. (6/7),CMOH_Alberta
2021-09-16 00:50:53+00:00,1438304346605821955,"This is a provincewide challenge that requires provincewide measures. Hosp. rates for COVID in rural areas are almost 3x those of YEG &amp; YYC. That is why there are provincial measures &amp; why it is critical that we all embrace them, regardless of where we live. (5/7)",CMOH_Alberta
2021-09-16 00:50:52+00:00,1438304345305587716,"New COVID-19 measures were announced today to reduce transmission. This includes restrictions on restaurants, indoor gatherings, weddings and funerals, places of worship, retail, entertainment venues, indoor sport and fitness, and schools. (4/7)",CMOH_Alberta
2021-09-16 00:50:52+00:00,1438304343975944195,"This crisis impacts all of us. The integrity of our healthcare system is essential to delivering urgent care to those who need it most. AHS has increased capacity to care for those who urgently need it, but it is equally vital that we reduce COVID-19 transmission across AB. (3/7)",CMOH_Alberta
2021-09-16 00:50:52+00:00,1438304342499540993,"Vaccines are safe &amp; they save lives. Vaccines are the key to not only preventing more sickness and deaths, but also preserving our healthcare system. Please get immunized if you haven't done so. (2/7)",CMOH_Alberta
2021-09-16 00:50:51+00:00,1438304340175990792,Here is a summary of today’s #COVID19AB update: I want to begin by recognizing all healthcare workers as they manage the accelerating impact of COVID patients on our healthcare system. We are in a crisis &amp; must urgently work together to again to deal with this situation. (1/7),CMOH_Alberta
2021-09-15 22:12:00+00:00,1438264365057134594,"A reminder that we will be providing a #COVID19AB update today at 6 pm. 
Join us virtually:
➡️Online: https://t.co/lmibh3zeBt
➡️Twitter: https://t.co/Yru945Y5QX (6/6)",CMOH_Alberta
2021-09-15 22:05:38+00:00,1438262761859866635,"Today’s numbers underscore how serious COVID-19 can be, and the need for every Albertan to take steps now to protect ourselves, our loved ones and our health-care system by getting vaccinated. (5/6)",CMOH_Alberta
